,NODE1,NODE2,TYPE,DATE,SOURCEINTEXT,SOURCE,CONTEXT
0,Foreign Ministry,Donald TRUMP,positive,6.20.2016,Christopher Steele,Steele dossier 2016/080 ,"Speaking to a trusted compatriot in June 2016 sources A and B, a senior Russian Foreign Ministry figure and a former top level Russian intelligence officer still active inside the Kremlin respectively, the Russian authorities had been cultivating and supporting US Republican presidential candidate, Donald TRUMP for at least 5 years."
1,Department K,FSB,positive,6.20.2016,Christopher Steele,Steele dossier 2016/080 ,"S/he confided in a trusted compatriot that it had been collated by Department K of the FSB for many years, dating back to her husband Bill's presidency, and comprised mainly eavesdropped conversations of various sorts rather than details/evidence of unorthodox or embarrassing behavior."
2,Kremlin,CLINTON,positive,6.20.2016,Christopher Steele,Steele dossier 2016/080 ,"Continuing on this theme, Source G, a senior Kremlin official, confided that the CLINTON dossier was controlled exclusively by chief Kremlin spokesman, Dmitriy PESKOV, who was responsible for compiling/handling it on the explicit instructions of PUTIN himself."
3,Kremlin,Dmitriy PESKOV,positive,6.20.2016,Christopher Steele,Steele dossier 2016/080 ,"Continuing on this theme, Source G, a senior Kremlin official, confided that the CLINTON dossier was controlled exclusively by chief Kremlin spokesman, Dmitriy PESKOV, who was responsible for compiling/handling it on the explicit instructions of PUTIN himself."
4,CLINTON,Dmitriy PESKOV,positive,6.20.2016,Christopher Steele,Steele dossier 2016/080 ,"Continuing on this theme, Source G, a senior Kremlin official, confided that the CLINTON dossier was controlled exclusively by chief Kremlin spokesman, Dmitriy PESKOV, who was responsible for compiling/handling it on the explicit instructions of PUTIN himself."
